{"meta_schemas":{"protocol-bundle":{"path":"formal/reviews/meta-schemas/review-protocol-bundle-v7.schema.json","sha256":"f1c2c91cedd8e248962d5890834472fcbbaab32daaf2bc76eccd3e910841f4f3"},"review-evidence":{"path":"formal/reviews/meta-schemas/review-evidence-v5.schema.json","sha256":"0f66a468c5afc0909389bf3bece221cc083e05a52f9e19be8b41c7e24d3e01bc"}},"policies":{"artifact_lifecycle":{"predecessor_chain_required":true,"protocol_changes_require_new_artifact_paths":true,"referenced_artifacts_immutable_by_path":true},"challenge":{"closure_contracts":[{"candidate_family":"materiality-assessment","challenge_kind":"materiality","challenge_subject_selector":"gate-a-materiality-assessment-challenge-v1","challenger_role":"challenge","required_objectives":["authority_or_upstream_decision","claim_structure","normative_provenance","modality_or_assurance_domain","coverage_or_residual_assurance","interaction_scope","candidate_model_authorization"],"revision_producer_role":"materiality-assessor","revision_task":"materiality-assessment","withdrawal":"not-permitted"},{"candidate_family":"refutation","challenge_kind":"refutation","challenge_subject_selector":"gate-a-refutation-candidate-challenge-v1","challenger_role":"challenge","required_objectives":["attacked-premise-still-supported","target-correctly-identified","counterexample-remains-in-scope","consequence-still-follows","not-actually-already-accounted-for","hidden-assumption-in-refutation","alternative-authority-compatible-interpretation"],"revision_producer_role":"refutation-builder","revision_task":"refutation","withdrawal":"not-established"},{"candidate_family":"unique-correction","challenge_kind":"derivation","challenge_subject_selector":"gate-a-unique-correction-candidate-challenge-v1","challenger_role":"challenge","required_objectives":["authority-does-not-entail-correction","materially-distinct-authority-compatible-alternative","required-consequence-omitted","unauthorized-semantic-effect","hidden-assumption-in-derivation"],"revision_producer_role":"derivation-builder","revision_task":"unique-correction-derivation","withdrawal":"not-established"},{"candidate_family":"realization-scope","challenge_kind":"derivation","challenge_subject_selector":"gate-a-realization-scope-candidate-challenge-v1","challenger_role":"challenge","required_objectives":["realization-scope-omits-required-surface","realization-scope-grants-unnecessary-write-authority"],"revision_producer_role":"derivation-builder","revision_task":"realization-scope-derivation","withdrawal":"not-established"},{"candidate_family":"no-normative-impact","challenge_kind":"normative-impact","challenge_subject_selector":"gate-a-no-normative-impact-candidate-challenge-v1","challenger_role":"challenge","required_objectives":["correction-requires-product-authority-change","correction-selects-among-product-meanings","missing-product-obligation-exposed","earliest-cause-is-normative-or-upstream","accepted-observable-behavior-would-change","downstream-resolution-requires-product-choice","authority-conflict-hidden-as-downstream-defect"],"revision_producer_role":"discovery-classifier","revision_target":"no-normative-impact","revision_task":"discovery-classification","revision_task_mode":"closure-revision","withdrawal":"not-established"},{"candidate_family":"decision-necessity","challenge_kind":"decision-necessity","challenge_subject_selector":"gate-a-decision-necessity-candidate-challenge-v1","challenger_role":"decision-necessity-challenger","required_objectives":["alternative-not-authority-compatible","alternatives-not-materially-distinct","existing-authority-selects-an-alternative","unique-existing-authority-derivation-remains","alleged-conflict-is-downstream-only","alleged-conflict-resolved-by-precedence","uncertainty-is-missing-evidence-not-product-freedom","authority-source-is-not-controlling"],"revision_producer_role":"discovery-classifier","revision_target":"decision-necessity","revision_task":"discovery-classification","revision_task_mode":"closure-revision","withdrawal":"not-established"},{"candidate_family":"repair-realization","challenge_kind":"repair","challenge_subject_selector":"gate-a-repair-realization-candidate-challenge-v1","challenger_role":"challenge","required_objectives":["authorized-correction-not-fully-realized","realization-exceeds-authorized-correction","product-semantic-choice-introduced","unrelated-cleanup-or-refactor","hidden-assumption-in-realization","previous-qualified-correction-broken","already-realized-claim-not-supported","required-candidate-change-omitted","partial-realization-misclassified-complete"],"revision_producer_role":"repair-synthesizer","revision_task":"repair-realization","withdrawal":"not-established"}],"exact_input_packet_binding_required":true,"incidental_findings_allowed":false,"max_closure_revisions":1,"semantic_result_model_shopping_allowed":false},"decision_request":{"scope":"full-current-subject-plus-current-protocol-plus-finding"},"external_outcomes":["GATE-A-READY","DECISION-REQUIRED","OPERATOR-ACTION-REQUIRED"],"model_identity":{"effective_duplicate_fields":["provider","model_version"],"identity_fields":["provider","model","model_version"],"provider_reported_resolution":"provider-owned-canonical-effective-model-identity-v1"},"normalization":{"mode":"one-to-one","semantic_deduplication_allowed":false,"semantic_merge_allowed":false},"retry":{"all_completed_attempts_must_be_sealed":true,"deterministically_validated_roles":["initial-reviewer","materiality-assessor","refutation-builder","challenge","discovery-classifier","derivation-builder","decision-necessity-challenger","repair-synthesizer"],"first_protocol_valid_completion_is_terminal":true,"outcome_classification":"role-aware-conservative","protocol_invalid_completion_retry_allowed":true,"semantic_result_retry_allowed":false,"technical_retry_allowed":true},"reviewer_acquisition":{"mode":"minimum-effective-independent-v1","profile_order":[]},"supporting_role_acquisition":{"mode":"first-statically-qualifying-in-reviewer-acquisition-order-v1"}},"predecessor":{"path":"formal/reviews/protocols/gate-a-campaign-protocol-v6.json","sha256":"841908ae137b1caaa8d0ae1035d7f888f736fda04ef70c10d33bda8383feae98"},"prompts":{"adjudication":{"path":"formal/reviews/prompts/gate-a-adjudication-v2.md","sha256":"eabe1cb19ace6ba8789cd0b03ab4622b3df6585f9d5c876361de87c265b89ca1"},"challenge":{"path":"formal/reviews/prompts/gate-a-challenge-v1.md","sha256":"b5fef8fd42eef80175556322c8067dc5ea9c1eb66869061e22ef194a434aeb65"},"initial-reviewer":{"path":"formal/reviews/prompts/gate-a-initial-review-v1.md","sha256":"516c63b4df16c72fb7ac1718fa4af5a9ab402e0ecf9c460d44a65858b7862748"},"repair":{"path":"formal/reviews/prompts/gate-a-repair-v2.md","sha256":"194d422e52c790d7444bfbb2a88f43d2d838f7a00bb1bfef8eef0c0138568940"}},"protocol_bundle_schema_version":7,"protocol_id":"gate-a-campaign-protocol-v7","review_class":"assurance-decomposition","reviewer_profiles":[],"schemas":{"adjudication-output":{"path":"formal/reviews/schemas/adjudication-output-v1.schema.json","sha256":"20b6e57eb630295442eee3200982529c4df9f5020724e601d595cdb11a0a9347"},"adjudication-packet":{"path":"formal/reviews/schemas/adjudication-packet-v1.schema.json","sha256":"c520db4ceb66bf906a80f2dc71cdcdbe35f632125639a28c78169ac942765ce1"},"challenge-output":{"path":"formal/reviews/schemas/challenge-output-v1.schema.json","sha256":"418245a1619b51090fc52e431996f05303ce6f38736423212879b6cb768419f2"},"challenge-packet":{"path":"formal/reviews/schemas/challenge-packet-v1.schema.json","sha256":"82f8c7956c860235def469a1975c3baf9572091bd9ce39b709bd1547338911ba"},"execution-receipt":{"path":"formal/reviews/schemas/execution-receipt-v4.schema.json","sha256":"9d5e0b50bf9b5464fadc9c57edfa265935bdf0ace9fcaf1c9770e5f7e7ab312c"},"finding-adjudication-supplement":{"path":"formal/reviews/schemas/finding-adjudication-supplement-v1.schema.json","sha256":"b9c60cc9bf786e9b127e7acffaa55a5156edfe29d521321c7f796f00dd3a20ca"},"raw-review-output":{"path":"formal/reviews/schemas/raw-review-output-v1.schema.json","sha256":"ab9c8f7c8d0e0314a925a7feb589975c98314c0e47e70c7794c1e1443aca8b6c"}}}
